{
  "schema_version": 1,
  "manifest_id": "std1-question-banks",
  "version": 1,
  "source": "Issue #13: initial approval record. Routes Standard-1 topic 4.1 (whole numbers to 100), TP1-TP2, DPK Edisi 3 core profile to the hand-reviewed Woolly Meadows bank (std1.woolly-meadows v1, authored and reviewed in issue #6). Rollback and approval procedure: docs/question-banks/manifest.md",
  "entries": [
    {
      "grade": "std1",
      "topic": "4.1",
      "tp_min": 1,
      "tp_max": 2,
      "profile": "dpk3_2026_core",
      "bank_id": "std1.woolly-meadows",
      "version": 1,
      "path": "question-banks/std1/woolly-meadows.v1"
    }
  ]
}
